{
  "analysis_context": {
    "arch": "arm64",
    "kernel_area": "arch/arm64/kvm",
    "subsystem": "kvm",
    "target_family": "kvm-arm64-narrow"
  },
  "candidate_id": "cand_59fda0076e3243f2",
  "constraints": {
    "events": [
      "init_resource",
      "escape",
      "free",
      "fetch",
      "use",
      "cleanup"
    ],
    "min_threads": 2,
    "partial_order": [
      {
        "after": "fetch",
        "before": "escape",
        "reason": "Pointer must escape before later fetch/use chain."
      },
      {
        "after": "use",
        "before": "free",
        "reason": "Use-after-free requires free to occur before use."
      },
      {
        "after": "fetch",
        "before": "escape",
        "reason": "VCPU timer context must be installed before it can be fetched from ioctl-side logic."
      },
      {
        "after": "use",
        "before": "free",
        "reason": "Cross-entry UAF requires timer teardown to occur before later timer use."
      }
    ],
    "predicates": [
      {
        "must_hold_at": "escape",
        "name": "kvm_vm_fd_ready",
        "scope": "heuristic"
      },
      {
        "must_hold_at": "fetch",
        "name": "kvm_vcpu_fd_ready",
        "scope": "heuristic"
      }
    ],
    "same_object": true
  },
  "entries": [
    {
      "entry_func": "kvm_vcpu_ioctl",
      "entry_kind": "file_ioctl",
      "grounded": {
        "entry_func": "kvm_vcpu_ioctl",
        "entry_kind": "file_ioctl",
        "mapping_source": "manual"
      },
      "heuristic": {},
      "support_level": "grounded",
      "supported": true,
      "syscall_templates": [
        {
          "calls": [
            "openat$KVM(AT_FDCWD, '/dev/kvm', O_RDWR)",
            "ioctl$KVM_CREATE_VM(fd_kvm, KVM_CREATE_VM, 0)",
            "ioctl$KVM_CREATE_VCPU(fd_vm, KVM_CREATE_VCPU, 0)",
            "ioctl$KVM_ARM_VCPU_INIT(fd_vcpu, KVM_ARM_VCPU_INIT, &init)",
            "ioctl$KVM_RUN(fd_vcpu, KVM_RUN, 0)"
          ],
          "notes": "Grounded KVM/arm64 VCPU execution scaffold with architecture init and run steps.",
          "required_resources": [
            "fd_kvm",
            "fd_vm",
            "fd_vcpu"
          ],
          "template_id": "kvm_vcpu_ioctl:file_ioctl:kvm-arm64:v2"
        },
        {
          "calls": [
            "openat$KVM(AT_FDCWD, '/dev/kvm', O_RDWR)",
            "ioctl$KVM_CREATE_VM(fd_kvm, KVM_CREATE_VM, 0)",
            "ioctl$KVM_CREATE_VCPU(fd_vm, KVM_CREATE_VCPU, 0)",
            "ioctl$KVM_ARM_VCPU_INIT(fd_vcpu, KVM_ARM_VCPU_INIT, &init)",
            "ioctl$KVM_SET_ONE_REG(fd_vcpu, KVM_SET_ONE_REG, &one_reg)",
            "ioctl$KVM_GET_ONE_REG(fd_vcpu, KVM_GET_ONE_REG, &one_reg)",
            "ioctl$KVM_RUN(fd_vcpu, KVM_RUN, 0)"
          ],
          "notes": "Grounded KVM/arm64 register-access scaffold for ioctl-heavy VCPU paths.",
          "required_resources": [
            "fd_kvm",
            "fd_vm",
            "fd_vcpu"
          ],
          "template_id": "kvm_vcpu_ioctl:file_ioctl:kvm-arm64:regs:v1"
        }
      ],
      "unsupported_reasons": []
    },
    {
      "entry_func": "kvm_vm_ioctl_create_vcpu",
      "entry_kind": "file_ioctl",
      "grounded": {
        "entry_func": "kvm_vm_ioctl_create_vcpu",
        "entry_kind": "file_ioctl",
        "mapping_source": "manual"
      },
      "heuristic": {},
      "support_level": "grounded",
      "supported": true,
      "syscall_templates": [
        {
          "calls": [
            "openat$KVM(AT_FDCWD, '/dev/kvm', O_RDWR)",
            "ioctl$KVM_CREATE_VM(fd_kvm, KVM_CREATE_VM, 0)",
            "ioctl$KVM_CREATE_VCPU(fd_vm, KVM_CREATE_VCPU, 0)"
          ],
          "notes": "Grounded KVM/arm64 setup scaffold for VM/VCPU creation.",
          "required_resources": [
            "fd_kvm",
            "fd_vm",
            "fd_vcpu"
          ],
          "template_id": "kvm_vm_ioctl_create_vcpu:file_ioctl:kvm-arm64:v1"
        }
      ],
      "unsupported_reasons": []
    }
  ],
  "flow": "Con",
  "loc0": {
    "context": [
      "kvm_vcpu_release",
      "kvm_timer_vcpu_terminate",
      "destroy_hrtimer"
    ],
    "file": "arch/arm64/kvm/arch_timer.c",
    "function": "kvm_timer_vcpu_terminate",
    "line": 812
  },
  "loc1": {
    "context": [
      "kvm_vcpu_ioctl",
      "kvm_timer_flush_hwstate",
      "kvm_timer_should_fire"
    ],
    "file": "arch/arm64/kvm/arch_timer.c",
    "function": "kvm_timer_should_fire",
    "line": 923
  },
  "provenance": {
    "normalizer": "extractor.import_uafx_bridge_export",
    "raw_warning_sha256_prefix": "54ff127daced8fae",
    "warning_id": "uafx-kvm-arm64-0001"
  },
  "raw_warning": {
    "analysis_kind": "cross_entry_uaf",
    "arch": "arm64",
    "condition_ops": [],
    "efp": {
      "clobber_sites": [
        {
          "function": "kvm_timer_vcpu_terminate",
          "stmt": "destroy_hrtimer(&timer->bg_timer)"
        }
      ],
      "escape_sites": [
        {
          "function": "kvm_vm_ioctl_create_vcpu",
          "object_hint": "struct kvm_vcpu_arch_timer",
          "stmt": "vcpu->arch.timer = timer_ctx"
        }
      ],
      "fetch_sites": [
        {
          "function": "kvm_vcpu_ioctl",
          "object_hint": "struct kvm_vcpu_arch_timer",
          "stmt": "timer = vcpu->arch.timer"
        }
      ]
    },
    "entry_candidates": [
      {
        "confidence": "grounded",
        "function": "kvm_vcpu_ioctl",
        "kind_hint": "file_ioctl"
      },
      {
        "confidence": "grounded",
        "function": "kvm_vm_ioctl_create_vcpu",
        "kind_hint": "file_ioctl"
      }
    ],
    "flow": "Con",
    "free_site": {
      "context": [
        "kvm_vcpu_release",
        "kvm_timer_vcpu_terminate",
        "destroy_hrtimer"
      ],
      "file": "arch/arm64/kvm/arch_timer.c",
      "function": "kvm_timer_vcpu_terminate",
      "line": 812
    },
    "kernel_area": "arch/arm64/kvm",
    "lock_ops": [],
    "object_hints": {
      "object_type": "struct kvm_vcpu_arch_timer",
      "same_object": true
    },
    "partial_order": [
      {
        "after": "fetch",
        "before": "escape",
        "reason": "VCPU timer context must be installed before it can be fetched from ioctl-side logic."
      },
      {
        "after": "use",
        "before": "free",
        "reason": "Cross-entry UAF requires timer teardown to occur before later timer use."
      }
    ],
    "predicate_hints": [
      {
        "must_hold_at": "escape",
        "name": "kvm_vm_fd_ready",
        "scope": "heuristic"
      },
      {
        "must_hold_at": "fetch",
        "name": "kvm_vcpu_fd_ready",
        "scope": "heuristic"
      }
    ],
    "thread_ops": [
      {
        "context_role": "use",
        "function": "kvm_timer_flush_hwstate",
        "kind": "workqueue"
      }
    ],
    "use_site": {
      "context": [
        "kvm_vcpu_ioctl",
        "kvm_timer_flush_hwstate",
        "kvm_timer_should_fire"
      ],
      "file": "arch/arm64/kvm/arch_timer.c",
      "function": "kvm_timer_should_fire",
      "line": 923
    },
    "warning_id": "uafx-kvm-arm64-0001"
  },
  "schema_version": "candidate/v1",
  "source": {
    "raw_file": "out/uafx_kvm_bridge_export.json",
    "tool": "uafx-bridge-import",
    "version": "0.1"
  },
  "status": {
    "grounded_entries": [
      "kvm_vcpu_ioctl",
      "kvm_vm_ioctl_create_vcpu"
    ],
    "heuristic_entries": [],
    "mapping_confidence": "manual",
    "ready_for_smt": true,
    "supported": true,
    "unsupported_entries": [],
    "unsupported_reasons": [
      "heuristic predicate preserved: kvm_vcpu_fd_ready",
      "heuristic predicate preserved: kvm_vm_fd_ready"
    ]
  }
}
