{
  "analysis_context": {
    "arch": "arm64",
    "kernel_area": "net/netfilter",
    "subsystem": "net",
    "target_family": "net-netfilter-arm64-v1"
  },
  "candidate_id": "cand_ca6bd5da811d1948",
  "constraints": {
    "events": [
      "init_resource",
      "escape",
      "free",
      "fetch",
      "use",
      "cleanup"
    ],
    "min_threads": 2,
    "partial_order": [
      {
        "after": "fetch",
        "before": "escape",
        "reason": "Pointer must escape before later fetch/use chain."
      },
      {
        "after": "use",
        "before": "free",
        "reason": "Use-after-free requires free to occur before use."
      },
      {
        "after": "fetch",
        "before": "escape",
        "reason": "The nft set must be created before later get/dump messages can resolve it."
      },
      {
        "after": "use",
        "before": "free",
        "reason": "The delete/get race requires teardown before a later dump-side use."
      }
    ],
    "predicates": [
      {
        "must_hold_at": "escape",
        "name": "netlink_socket_ready",
        "scope": "heuristic"
      },
      {
        "must_hold_at": "fetch",
        "name": "nft_object_visible",
        "scope": "heuristic"
      }
    ],
    "same_object": true
  },
  "entries": [
    {
      "entry_func": "nfnetlink_rcv_batch",
      "entry_kind": "netlink_send",
      "grounded": {
        "confidence": "grounded",
        "entry_func": "nfnetlink_rcv_batch",
        "entry_kind": "netlink_send",
        "entry_kind_hint": "netlink_send",
        "mapping_source": "manual"
      },
      "heuristic": {},
      "support_level": "grounded",
      "supported": true,
      "syscall_templates": [
        {
          "calls": [
            "socket$NETLINK_NETFILTER(AF_NETLINK, SOCK_RAW, NETLINK_NETFILTER)",
            "sendmsg$NFT_BATCH_CREATE(fd_nl, &msg_create, 0)",
            "sendmsg$NFT_BATCH_UPDATE(fd_nl, &msg_update, 0)",
            "recvmsg$NETLINK_DUMP(fd_nl, &msg_dump, 0)",
            "sendmsg$NFT_BATCH_DELETE(fd_nl, &msg_delete, 0)",
            "close$NETLINK_NETFILTER(fd_nl)"
          ],
          "notes": "Hardware-light netlink/netfilter scaffold covering create/update/dump/delete flows.",
          "required_resources": [
            "fd_nl"
          ],
          "template_id": "nfnetlink_rcv_batch:netlink_send:net-netfilter-arm64:v1"
        }
      ],
      "unsupported_reasons": []
    }
  ],
  "flow": "Con",
  "loc0": {
    "context": [
      "nfnetlink_rcv_batch",
      "nf_tables_destroy_set",
      "kfree"
    ],
    "file": "net/netfilter/nf_tables_api.c",
    "function": "nf_tables_destroy_set",
    "line": 6123
  },
  "loc1": {
    "context": [
      "nfnetlink_rcv_batch",
      "nf_tables_getset",
      "nf_tables_dump_set"
    ],
    "file": "net/netfilter/nf_tables_api.c",
    "function": "nf_tables_dump_set",
    "line": 7441
  },
  "provenance": {
    "normalizer": "extractor.import_uafx_bridge_export",
    "raw_warning_sha256_prefix": "7af1630db31e2a63",
    "warning_id": "uafx-net-arm64-0001"
  },
  "raw_warning": {
    "analysis_kind": "cross_entry_uaf",
    "arch": "arm64",
    "condition_ops": [],
    "efp": {
      "clobber_sites": [
        {
          "function": "nf_tables_destroy_set",
          "stmt": "kfree(set)"
        }
      ],
      "escape_sites": [
        {
          "function": "nf_tables_newset",
          "object_hint": "struct nft_set",
          "stmt": "set = nft_set_alloc()"
        }
      ],
      "fetch_sites": [
        {
          "function": "nf_tables_getset",
          "object_hint": "struct nft_set",
          "stmt": "set = nft_set_lookup_byhandle()"
        }
      ]
    },
    "entry_candidates": [
      {
        "confidence": "grounded",
        "function": "nfnetlink_rcv_batch",
        "kind_hint": "netlink_send"
      }
    ],
    "flow": "Con",
    "free_site": {
      "context": [
        "nfnetlink_rcv_batch",
        "nf_tables_destroy_set",
        "kfree"
      ],
      "file": "net/netfilter/nf_tables_api.c",
      "function": "nf_tables_destroy_set",
      "line": 6123
    },
    "kernel_area": "net/netfilter",
    "lock_ops": [],
    "object_hints": {
      "object_type": "struct nft_set",
      "same_object": true
    },
    "partial_order": [
      {
        "after": "fetch",
        "before": "escape",
        "reason": "The nft set must be created before later get/dump messages can resolve it."
      },
      {
        "after": "use",
        "before": "free",
        "reason": "The delete/get race requires teardown before a later dump-side use."
      }
    ],
    "predicate_hints": [
      {
        "must_hold_at": "escape",
        "name": "netlink_socket_ready",
        "scope": "heuristic"
      },
      {
        "must_hold_at": "fetch",
        "name": "nft_object_visible",
        "scope": "heuristic"
      }
    ],
    "subsystem": "net",
    "target_family": "net-netfilter-arm64-v1",
    "thread_ops": [
      {
        "context_role": "free",
        "function": "nfnetlink_rcv_batch",
        "kind": "netlink_batch"
      },
      {
        "context_role": "use",
        "function": "nf_tables_dump_set",
        "kind": "dump"
      }
    ],
    "use_site": {
      "context": [
        "nfnetlink_rcv_batch",
        "nf_tables_getset",
        "nf_tables_dump_set"
      ],
      "file": "net/netfilter/nf_tables_api.c",
      "function": "nf_tables_dump_set",
      "line": 7441
    },
    "warning_id": "uafx-net-arm64-0001"
  },
  "schema_version": "candidate/v1",
  "source": {
    "raw_file": "/Users/CJ/Desktop/Kernel-stuff/madelin/backend/syz-guided/tests/fixtures/packs/net/uafx_bridge_export.json",
    "tool": "uafx-bridge-import",
    "version": "0.2"
  },
  "status": {
    "grounded_entries": [
      "nfnetlink_rcv_batch"
    ],
    "heuristic_entries": [],
    "mapping_confidence": "manual",
    "ready_for_smt": true,
    "supported": true,
    "unsupported_entries": [],
    "unsupported_reasons": [
      "heuristic predicate preserved: netlink_socket_ready",
      "heuristic predicate preserved: nft_object_visible"
    ]
  }
}
